{
  "id": "mentivor_main",
  "name": "Mentivor",
  "version": "v1",

  "trigger_token": "mntvrchar",
  "persistent": true,
  "identity_locked": true,

  "role": "protagonist",
  "status": "trained",

  "identity": {
    "head": {
      "shape": "large simple rounded head, smooth circular/oval silhouette",
      "skin_tone": "white to warm cream",
      "detail_level": "minimal facial geometry, no realistic skin texture, no detailed human facial anatomy"
    },
    "eyes": {
      "style": "two small solid black dot eyes",
      "detail_level": "no realistic pupils, no detailed irises, no photorealistic eyes"
    },
    "eyebrows": {
      "style": "thin, black, curved",
      "function": "primary emotion communicator"
    },
    "nose": {
      "style": "no visible detailed nose",
      "constraint": "at most extremely subtle implied geometry; never realistic"
    },
    "mouth": {
      "style": "minimal, simple expressions",
      "allowed_emotions": [
        "curiosity",
        "confusion",
        "concern",
        "sadness",
        "relief",
        "thoughtfulness",
        "surprise",
        "quiet happiness",
        "determination"
      ],
      "constraint": "no exaggerated cartoon comedy"
    },
    "hair": {
      "color": "black",
      "style": "dark, messy, spiky, slightly irregular spikes",
      "silhouette": "recognizable from different camera angles",
      "locked": true,
      "constraint": "must not change style, color, length, or texture between scenes"
    },
    "body": {
      "proportions": "simplified stylized human proportions",
      "build": "slim/average, youthful, not muscular, not extremely skinny",
      "constraint": "not chibi, not realistic human anatomy",
      "hands": "simplified but must convincingly interact with objects"
    }
  },

  "canonical_outfit": "navy_hoodie",
  "approved_outfits": {
    "navy_hoodie": {
      "description": "navy blue pullover hoodie with white hoodie drawstrings, black/dark sweatpants, simple white sneakers",
      "default": true
    },
    "navy_sweater": {
      "description": "navy sweater/shirt variation",
      "default": false,
      "note": "use only if scene metadata explicitly requests it; pending confirmation against reference images"
    }
  },

  "identity_lock_rules": {
    "must_not_drift": [
      "face_shape",
      "face_color",
      "eye_style",
      "hair_silhouette",
      "hair_color",
      "body_proportions",
      "default_outfit_colors",
      "overall_illustration_language"
    ],
    "may_vary_freely": [
      "camera_angle",
      "pose",
      "emotion",
      "environment",
      "lighting_condition",
      "object_interaction"
    ]
  },

  "negative_constraints": [
    "photorealistic Mentivor",
    "realistic human eyes",
    "detailed realistic nose",
    "wrong hair",
    "blond/brown hair",
    "random clothing changes",
    "anime",
    "manga",
    "3D Pixar appearance",
    "children's cartoon aesthetic",
    "excessive saturation",
    "malformed body",
    "duplicate protagonist"
  ],

  "references": {
    "directory": "characters/mentivor/references/",
    "count": 0,
    "note": "populate in Phase 3/4 dataset import step"
  },

  "training": {
    "lora_path": "characters/mentivor/lora/mentivor_character_v1.safetensors",
    "embedding_path": null,
    "trained": true,
    "recommended_lora_strength": 1.2,
    "prompting_notes": "Outfit (navy hoodie, black pants, white sneakers) must be explicitly stated in every prompt - not reliably carried by trigger token alone. Add negative prompt: text, logo, letters, writing."
  }
}
